ID,age,workclass,fnlwgt,education,education_cat,marital_status,occupation,relationship,race,gender,capital_gain,capital_loss,hour_per_week,native_country,class
9364,38, Private,197077, HS-grad,9, Married-civ-spouse, Other-service, Husband, White, Male,0,0,40, United-States, <=50K
25668,31, Private,101761, HS-grad,9, Married-civ-spouse, Craft-repair, Husband, White, Male,0,0,51, United-States, <=50K
13316,26, Private,152855, HS-grad,9, Never-married, Exec-managerial, Own-child, Other, Female,0,0,40, Mexico, <=50K
28750,50, Self-emp-not-inc,99894, 5th-6th,3, Never-married, Tech-support, Not-in-family, Asian-Pac-Islander, Female,0,0,15, United-States, <=50K
30619,35, Private,412379, HS-grad,9, Never-married, Other-service, Not-in-family, White, Female,0,0,40, United-States, <=50K
1484,26, Private,256263, HS-grad,9, Never-married, Craft-repair, Not-in-family, White, Male,0,0,25, United-States, <=50K
17193,18, Private,95917, HS-grad,9, Never-married, Other-service, Own-child, White, Male,0,0,25, Canada, <=50K
99999,31, Private,101761, HS-grad,9, Married-civ-spouse, Craft-repair, Husband, White, Male,0,0,51, United-States, <=50K
